{"benchmark_id":"bench_34838d25385f4e1c9d98a052","case_count":21,"environment":{"platform":"Linux-6.17.0-1020-azure-x86_64-with-glibc2.39","python":"3.12.13"},"kind":"retrieval","metrics":{"estimated_cost_usd":0.0,"failure_rate_by_category":{"contradiction-disagreement":0.0,"conversation-lineage":0.0,"cross-pack-isolation":0.0,"current-vs-historical":0.5,"decision-lineage":0.0,"exact-factual-lookup":0.0,"insufficient-evidence":0.0,"obscure-deep-evidence":0.0,"source-citation-recovery":0.0,"stale-superseded":0.0},"hit_rate":0.9523809523809523,"limit":5,"mean_latency_ms":1.255595000002142,"mean_recall_at_k":0.9206349206349206,"mrr":0.8373015873015872,"p95_latency_ms":1.4634109999747125,"peak_python_alloc_bytes":34570},"observations":[{"case_id":"source_quality_claim_specific","category":"source-citation-recovery","failed":false,"latency_ms":0.6675910000240037,"recall_at_k":1.0,"reciprocal_rank":1.0,"relevant_ids":["clm_32f20bd13ce2ffc9d2ac1606"],"returned_ids":["clm_32f20bd13ce2ffc9d2ac1606","clm_041fdd3cc6542b6dca47b183"]},{"case_id":"model_agreement_not_evidence","category":"insufficient-evidence","failed":false,"latency_ms":0.7436430000211658,"recall_at_k":1.0,"reciprocal_rank":1.0,"relevant_ids":["clm_7fee179225b3ef0c4d413917"],"returned_ids":["clm_7fee179225b3ef0c4d413917","clm_32f20bd13ce2ffc9d2ac1606","clm_041fdd3cc6542b6dca47b183"]},{"case_id":"insufficient_evidence_keeps_uncertainty","category":"insufficient-evidence","failed":false,"latency_ms":0.6976369999733834,"recall_at_k":1.0,"reciprocal_rank":1.0,"relevant_ids":["clm_041fdd3cc6542b6dca47b183"],"returned_ids":["clm_041fdd3cc6542b6dca47b183","clm_7fee179225b3ef0c4d413917","clm_32f20bd13ce2ffc9d2ac1606"]},{"case_id":"gate1_controls_not_winners","category":"exact-factual-lookup","failed":false,"latency_ms":1.4205800000013369,"recall_at_k":1.0,"reciprocal_rank":1.0,"relevant_ids":["clm_6542963629260bde4e67d660"],"returned_ids":["clm_6542963629260bde4e67d660","clm_a047d79b8604fadbd44efdf4","clm_1f4c5f053bd7dccac79c301c","rel_0996c7d4b845cf3a3fc6bdf8","clm_bdf2ed41fb11e6b1808d3df4"]},{"case_id":"fresh_build_scoped_ledger","category":"obscure-deep-evidence","failed":false,"latency_ms":1.3733629999705954,"recall_at_k":1.0,"reciprocal_rank":1.0,"relevant_ids":["clm_62b7f9c6184b14371338ca36"],"returned_ids":["clm_62b7f9c6184b14371338ca36","clm_bdf2ed41fb11e6b1808d3df4","rel_c0e74317e7ff1ee59461b036","clm_76c6bead3d10df4ca7de8af4","rel_04b8861fde6b22abcae58ef4"]},{"case_id":"candidate_authority_cross_pack_dependency","category":"cross-pack-isolation","failed":false,"latency_ms":1.5324400000054084,"recall_at_k":1.0,"reciprocal_rank":1.0,"relevant_ids":["rel_04b8861fde6b22abcae58ef4"],"returned_ids":["rel_04b8861fde6b22abcae58ef4","clm_1ca1ee32e949eccdea16beb9","clm_7fee179225b3ef0c4d413917","clm_a047d79b8604fadbd44efdf4","clm_bdf2ed41fb11e6b1808d3df4"]},{"case_id":"current_architecture_after_reconsideration","category":"current-vs-historical","failed":true,"latency_ms":1.4093789999947148,"recall_at_k":0.0,"reciprocal_rank":0.0,"relevant_ids":["clm_7f5c691c564c30e1b61f8dc0"],"returned_ids":["clm_643b698b7e9e6aee6a16c48c","clm_a047d79b8604fadbd44efdf4","rel_0996c7d4b845cf3a3fc6bdf8","clm_bdf2ed41fb11e6b1808d3df4","clm_fabdddf47e97cdd1876329fe"]},{"case_id":"former_sqlite_canonical_history","category":"current-vs-historical","failed":false,"latency_ms":1.395242999990387,"recall_at_k":1.0,"reciprocal_rank":0.3333333333333333,"relevant_ids":["clm_643b698b7e9e6aee6a16c48c"],"returned_ids":["clm_6542963629260bde4e67d660","clm_bdf2ed41fb11e6b1808d3df4","clm_643b698b7e9e6aee6a16c48c","clm_677f372218d173f32ab6cb30","rel_0996c7d4b845cf3a3fc6bdf8"]},{"case_id":"sqlite_supersession_lineage","category":"decision-lineage","failed":false,"latency_ms":1.3681819999646905,"recall_at_k":1.0,"reciprocal_rank":0.25,"relevant_ids":["rel_e0102ade0b5fad5cc2668ccd"],"returned_ids":["rel_0996c7d4b845cf3a3fc6bdf8","clm_a047d79b8604fadbd44efdf4","clm_643b698b7e9e6aee6a16c48c","rel_e0102ade0b5fad5cc2668ccd","clm_1ca1ee32e949eccdea16beb9"]},{"case_id":"sqlite_dependent_staleness","category":"stale-superseded","failed":false,"latency_ms":1.4282250000405838,"recall_at_k":1.0,"reciprocal_rank":1.0,"relevant_ids":["clm_a047d79b8604fadbd44efdf4"],"returned_ids":["clm_a047d79b8604fadbd44efdf4","rel_0996c7d4b845cf3a3fc6bdf8","clm_643b698b7e9e6aee6a16c48c","clm_bdf2ed41fb11e6b1808d3df4","rel_e0102ade0b5fad5cc2668ccd"]},{"case_id":"graph_canonical_rejected","category":"contradiction-disagreement","failed":false,"latency_ms":1.3565009999751965,"recall_at_k":1.0,"reciprocal_rank":1.0,"relevant_ids":["clm_bdf2ed41fb11e6b1808d3df4"],"returned_ids":["clm_bdf2ed41fb11e6b1808d3df4","clm_643b698b7e9e6aee6a16c48c","rel_c0e74317e7ff1ee59461b036","rel_0996c7d4b845cf3a3fc6bdf8","clm_a047d79b8604fadbd44efdf4"]},{"case_id":"graphiti_current_role","category":"exact-factual-lookup","failed":false,"latency_ms":1.388090000034481,"recall_at_k":1.0,"reciprocal_rank":1.0,"relevant_ids":["clm_f69dd23d961d485db1c53f0b"],"returned_ids":["clm_f69dd23d961d485db1c53f0b","rel_c0e74317e7ff1ee59461b036","rel_e0102ade0b5fad5cc2668ccd","clm_7f5c691c564c30e1b61f8dc0","clm_fabdddf47e97cdd1876329fe"]},{"case_id":"graph_disagreement_relation","category":"contradiction-disagreement","failed":false,"latency_ms":1.3389080000365539,"recall_at_k":1.0,"reciprocal_rank":1.0,"relevant_ids":["rel_c0e74317e7ff1ee59461b036"],"returned_ids":["rel_c0e74317e7ff1ee59461b036","clm_f69dd23d961d485db1c53f0b","rel_04b8861fde6b22abcae58ef4","rel_e0102ade0b5fad5cc2668ccd","clm_1f4c5f053bd7dccac79c301c"]},{"case_id":"logical_packs_over_physical_shards","category":"obscure-deep-evidence","failed":false,"latency_ms":1.2919490000058431,"recall_at_k":1.0,"reciprocal_rank":1.0,"relevant_ids":["clm_783ff75008ce760e0a227fa9"],"returned_ids":["clm_783ff75008ce760e0a227fa9","clm_1f4c5f053bd7dccac79c301c","clm_62b7f9c6184b14371338ca36","clm_677f372218d173f32ab6cb30"]},{"case_id":"recovery_is_reconstructed","category":"conversation-lineage","failed":false,"latency_ms":1.4634109999747125,"recall_at_k":1.0,"reciprocal_rank":1.0,"relevant_ids":["clm_fabdddf47e97cdd1876329fe"],"returned_ids":["clm_fabdddf47e97cdd1876329fe","clm_841df02f01de69cafeb9c084","clm_a047d79b8604fadbd44efdf4","rel_0996c7d4b845cf3a3fc6bdf8","clm_f69dd23d961d485db1c53f0b"]},{"case_id":"lost_chat_exact_wording_unavailable","category":"conversation-lineage","failed":false,"latency_ms":1.4216630000305486,"recall_at_k":1.0,"reciprocal_rank":1.0,"relevant_ids":["clm_1f4c5f053bd7dccac79c301c"],"returned_ids":["clm_1f4c5f053bd7dccac79c301c","rel_0996c7d4b845cf3a3fc6bdf8","clm_f69dd23d961d485db1c53f0b","clm_643b698b7e9e6aee6a16c48c","clm_a047d79b8604fadbd44efdf4"]},{"case_id":"do_not_invent_recovery_wording","category":"conversation-lineage","failed":false,"latency_ms":1.2788150000346832,"recall_at_k":1.0,"reciprocal_rank":1.0,"relevant_ids":["clm_841df02f01de69cafeb9c084"],"returned_ids":["clm_841df02f01de69cafeb9c084","clm_677f372218d173f32ab6cb30","clm_1ca1ee32e949eccdea16beb9","clm_fabdddf47e97cdd1876329fe"]},{"case_id":"later_primary_evidence_preferred","category":"conversation-lineage","failed":false,"latency_ms":1.2528869999641756,"recall_at_k":1.0,"reciprocal_rank":1.0,"relevant_ids":["clm_677f372218d173f32ab6cb30"],"returned_ids":["clm_677f372218d173f32ab6cb30","clm_62b7f9c6184b14371338ca36","clm_6542963629260bde4e67d660"]},{"case_id":"false_premise_quote_missing_chat","category":"conversation-lineage","failed":false,"latency_ms":1.4437340000199583,"recall_at_k":1.0,"reciprocal_rank":0.5,"relevant_ids":["clm_1f4c5f053bd7dccac79c301c","clm_841df02f01de69cafeb9c084"],"returned_ids":["clm_a047d79b8604fadbd44efdf4","clm_841df02f01de69cafeb9c084","rel_0996c7d4b845cf3a3fc6bdf8","clm_fabdddf47e97cdd1876329fe","clm_1f4c5f053bd7dccac79c301c"]},{"case_id":"historical_current_supersession_bundle","category":"decision-lineage","failed":false,"latency_ms":1.333737999971163,"recall_at_k":0.3333333333333333,"reciprocal_rank":0.5,"relevant_ids":["clm_643b698b7e9e6aee6a16c48c","clm_7f5c691c564c30e1b61f8dc0","rel_e0102ade0b5fad5cc2668ccd"],"returned_ids":["rel_0996c7d4b845cf3a3fc6bdf8","rel_e0102ade0b5fad5cc2668ccd","clm_1ca1ee32e949eccdea16beb9","clm_a047d79b8604fadbd44efdf4","rel_04b8861fde6b22abcae58ef4"]},{"case_id":"common_mount_isolation","category":"cross-pack-isolation","failed":false,"latency_ms":0.7615160000113974,"recall_at_k":1.0,"reciprocal_rank":1.0,"relevant_ids":["clm_7fee179225b3ef0c4d413917"],"returned_ids":["clm_7fee179225b3ef0c4d413917","clm_041fdd3cc6542b6dca47b183","clm_32f20bd13ce2ffc9d2ac1606"]}],"recorded_at":"2026-08-10T06:52:08.010724+00:00","schema_version":"fossil.benchmark.v1","service":{"estimated_cost_per_call_usd":0.0,"implementation":"in-memory-cosine","implementation_version":"gate2-comparison-v1","kind":"retriever","local":true,"model_id":"fossil-hash-embedding-128-vgate2-comparison-v1","provider":"fossil","provider_version":"1","runtime":{"embedding_provider":"fossil"}}}